{
  "schema": "ophiolite.procedure/1",
  "name": "send-tops",
  "label": "Send tops to the partner",
  "version": 1,
  "step": "send",
  "inputs": [
    {
      "slot": "tops",
      "label": "Tops to send",
      "class": "version",
      "kinds": [
        "well-tops-csv/1",
        "las2/1"
      ],
      "cardinality": "many"
    }
  ],
  "outputs": [
    {
      "role": "delivery",
      "label": "Sent files",
      "class": "delivery"
    }
  ],
  "entry": "procedure:send"
}
