{
  "schema": "ophiolite.procedure/1",
  "name": "field-db/tops",
  "label": "Tops from the field database",
  "version": 1,
  "step": "source",
  "inputs": [
    {
      "slot": "database",
      "label": "Field database",
      "class": "system",
      "config_keys": [
        "host",
        "user",
        "password"
      ]
    }
  ],
  "outputs": [
    {
      "role": "tops",
      "label": "Tops",
      "class": "version",
      "kind": "well-tops-csv/1"
    },
    {
      "role": "location",
      "label": "Well location",
      "class": "version",
      "kind": "well-location/1"
    }
  ],
  "entry": "procedure:fetch"
}
